name,developer,publisher,platform,release_date,summary,meta_score,user_review
Braid,Number None,Number None, Xbox 360,2008-08-06,"[Xbox Live Arcade] Braid is a puzzle-platformer, drawn in a painterly style, where the player manipulates the flow of time in strange and unusual ways. From a house in the city, journey to a series of worlds and solve puzzles to rescue an abducted princess. In each world, you have a different power to affect the way time behaves, and it is time's strangeness that creates the puzzles. The time behaviors include: the ability to rewind, objects that are immune to being rewound, time that is tied to space, parallel realities, time dilation, and perhaps more. Braid treats your time and attention as precious; there is no filler in this game. Every puzzle shows you something new and interesting about the game world. Braid is a 2-D platform game where you can never die and never lose. Despite this, Braid is challengingâ??but the challenge is about solving puzzles, rather than forcing you to replay tricky jumps. Travel through a series of worlds searching for puzzle pieces, then solving puzzles by manipulating time: rewinding, creating parallel universes, setting up pockets of dilated time. The gameplay feels fresh and new; the puzzles are meant to inspire new ways of thinking. [Microsoft]",93,8.5
God of War II,Santa Monica Studio,Sony Computer Entertainment, PlayStation 2,2007-03-13,"[Metacritic's 2007 PS2 Game of the Year] God of War saw Kratos, a mortal warrior, set upon an epic quest to dethrone a God. But his journey did not end there. In God of War II, Kratos sits atop his Olympus throne, as the new God of War – far more ruthless than Ares ever was. To end his continued torment, Kratos must journey to the far reaches of the earth and defeat untold horrors and alter that which no mortal, or god has ever changed, his fate. God of War II sets an epic stage for a devastating mythological war to end all wars. In God of War II, players retake the role of Kratos. Armed with the deadly blades and blistering rage, players are aided by new breath-taking magic and new brutal combat moves. The journey takes them through vividly striking environments where they are faced with a labyrinth of challenging puzzles and mini-games intricately woven into the story. The violent world of Greek mythology comes to life in gory detail as Kratos encounters new mythical characters, and compete in epic boss battles in his quest. [SCEA]",93,9
Super Mario 3D World,Nintendo,Nintendo, Wii U,2013-11-22,"Work together with your friends or compete for the crown in the first multiplayer 3D Mario game for the Wii U console. In the Super Mario 3D World game, players can choose to play as Mario, Luigi, Princess Peach or Toad.",93,8.9
Starcraft II: Wings of Liberty,Blizzard Enterainment,Blizzard Entertainment, PC,2010-07-27,"StarCraft II continues the epic saga of the Protoss, Terran, and Zerg. These three distinct and powerful races clash once again in the fast-paced real-time strategy sequel to the legendary original, StarCraft. Legions of veteran, upgraded, and brand-new unit types do battle across the galaxy, as each faction struggles for survival. Featuring a unique single-player campaign that picks up where StarCraft: Brood War left off, StarCraft II presents a cast of new heroes and familiar faces in an edgy sci-fi story filled with adventure and intrigue. In addition, Blizzard again offers unparalleled online play through Battle.net, the company's world-renowned gaming service, with several enhancements and new features to make StarCraft II the ultimate competitive real-time strategy game. Features fast-paced, hard-hitting, tightly balanced competitive real-time strategy gameplay that recaptures and improves on the magic of the original game. New units and gameplay mechanics further distinguish each race. Vibrant new 3D-graphics engine with support for dazzling visual effects and massive unit and army sizes. Full map-making and scripting tools to give players incredible freedom in customizing and personalizing their gameplay experience. [Blizzard]",93,8.3
SSX,EA Canada,EA Sports, PlayStation 2,2000-10-30,"Remember when snowboard sims used to suck? The times have truly changed with the monster speed, detailed tracks and super-fast frame rates of EA's first extreme sports game for the PS2.",93,8.1
Street Fighter IV,CAPCOM,CAPCOM, Xbox 360,2009-02-17,"Street Fighter IV features a mix of returning favourites such as Ryu, Ken, Chun-Li and Guile along with new characters created exclusively for this game such as Crimson Viper, Abel, El Fuerte, and Rufus. Characters and environments are rendered in high definition 3D, while the game is played in the classic Street Fighter 2D perspective with additional 3D camera flourishes. Six-button controls for the game return, with a host of new special moves and features integrated into the input system. Street Fighter IV also incorporates state of the art online match making and worldwide online gameplay. Mixing classic genre-defining game mechanics the franchise is known and loved for with all-new, never-before-seen gameplay systems, Street Fighter IV brings a brand new fighting game to fans the world over. With the inclusion of Capcom's latest advancements in new generation technology, Street Fighter IV promises to deliver an extraordinary experience that will re-introduce the world to the time-honoured art of virtual martial arts. New special moves that go beyond any Street Fighter fan's wildest imagination, including Focus attacks, Super Combos, and the revenged-fueled Ultra Combo system. Classic Street Fighter characters recreated for a new generation of gamers, including the original cast of Street Fighter II. New brawlers: female super-spy Crimson Viper, lucha libre wrestler El Fuerte, mixed martial artist Abel and more. New gameplay elements provide new challenges for both newcomers and the most seasoned Street Fighter pro. Online gameplay features, including instantaneous online challenges, versus mode, tournament mode, and world wide online gameplay. [Capcom]",93,7.3
Minecraft,Mojang Studios,Mojang Studios, PC,2011-11-18,"The game involves players creating and destroying various types of blocks in a three dimensional environment. The player takes an avatar that can destroy or create blocks, forming fantastic structures, creations and artwork across the various multiplayer servers in multiple game modes.",93,8
Undertale,Toby Fox,Toby Fox, Switch,2018-09-18,"Welcome to UNDERTALE. In this RPG, you control a human who falls underground into the world of monsters. Now you must find your way out... or stay trapped forever. ((Healthy Dog's Warning: Game contains imagery that may be harmful to players with photosensitive epilepsy or similar condition.)) features: * Killing is unnecessary: negotiate out of danger using the unique battle system. * Time your attacks for extra damage, then dodge enemy attacks in a style reminiscent of top-down shooters. * Original art and soundtrack brimming with personality. * Soulful, character-rich story with an emphasis on humor. * Created mostly by one person. * Become friends with all of the bosses! * At least 5 dogs. * You can date a skeleton. * Hmmm... now there are 6 dogs...? * Maybe you won't want to date the skeleton. * I thought I found a 7th dog, but it was actually just the 3rd dog. * If you play this game, can you count the dogs for me...? I'm not good at it.",93,8.2
Persona 4 Golden,Atlus,Atlus, PlayStation Vita,2012-11-20,Persona 4: The Golden is a remastered version of PS2 classic Shin Megami Tensei: Persona 4.,93,8.6
Persona 5,P-Studio,Atlus, PlayStation 4,2017-04-04,"Beneath the veneer of typical urban high school life, a group of teenagers mask their mysterious alter egos, their ""phantom thief"" side. Who are they? Why are they dressed as such? What are their motives? And... why are they being pursued? A picaresque coming-of-age story, Persona 5 brings a new twist to the RPG genre. Assume the role of a second-year high school student who becomes a Persona-user through an unexpected incident. Having moved to Tokyo just before the start of the school year, he finds residence at a cafe run by his parents' friend, and is about to get his first taste of school life in the big city. The protagonist seems quiet and well-mannered at first glance, but gives a completely different impression once he has donned his ""phantom thief"" guise. What is the motivation of his alter ego...? Arsene is the protagonist's initial Persona, characterized by a mask-like face and a pair of huge, black wings. Some suspect an association between its name and the famous gentleman-thief, Arsene Lupin. What is the origin of this Persona, and what power does it hold? This is an account of the wild adventures experienced by a team of young misfits, who grow dramatically along the way. While attending Shujin High School, the protagonist will encounter a number of individuals, each with his or her own distinctive personality and charm. School life in the city is full of surprises and interesting events! It will most definitely be a fun year for the protagonist, living as an ordinary student. However, he and his friends become involved in an incident which leads to the awakening of their Personas. No one would ever suspect that these adolescents will eventually shake the world... Welcome to the next iteration of the Persona series, boasting a brand new metropolitan setting, all-new cast, and fresh, original story. [Atlus]",93,8.7
Red Dead Redemption 2,Rockstar Games,Rockstar Games, PC,2019-11-05,"America, 1899. The end of the wild west era has begun as lawmen hunt down the last remaining outlaw gangs. Those who will not surrender or succumb are killed. After a robbery goes badly wrong in the western town of Blackwater, Arthur Morgan and the Van der Linde gang are forced to flee. With federal agents and the best bounty hunters in the nation massing on their heels, the gang must rob, steal and fight their way across the rugged heartland of America in order to survive. As deepening internal divisions threaten to tear the gang apart, Arthur must make a choice between his own ideals and loyalty to the gang who raised him. From the creators of Grand Theft Auto V and Red Dead Redemption, Red Dead Redemption 2 is an epic tale of life in America at the dawn of the modern age.",93,6.2
SSX 3,EA Canada,EA Sports, PlayStation 2,2003-10-20,"Embark on the ultimate adventure and conquer the mountain with SSX 3. Life begins at the summit where a wide-open mountain awaits you -- board it, explore it, and beat it. Featuring all-new freestyle events and race courses, jaw-dropping tricks, and a cast of cool, customizable characters, SSX 3 is yours to conquer. Redefine the boundaries what you do and what you earn, and go anywhere gravity takes you with SSX 3! [Electronic Arts]",93,8.8
Tom Clancy's Splinter Cell,Ubisoft Montreal,Ubisoft, Xbox,2002-11-17,"Infiltrate terrorists' positions, acquire critical intelligence by any means necessary, execute with extreme prejudice, and exit without a trace. In Tom Clancy's Splinter Cell, you are Sam Fisher, a highly trained secret operative of the NSA's secret arm: Third Echelon. Suit up with the latest classified field operative gear and weapons as you travel through diverse mission objectives. The world's future is in your hands, as cyber terrorism and international tensions are about to explode into WWIII.",93,8.6
Grand Theft Auto III,DMA Design,Rockstar Games, PC,2002-05-20,"The PC version features enhanced 3D audio. Environmentally scaled and referenced from the player's perspective. Create your own customizable Liberty City radio station, using the built-in mp3 player. State-of-the art visuals utilizing the latest PC hardware render the city more beautifully than ever in 32 bit color. The skinnable player character enables fans to create and upload their own skin textures and to use a scanned-in photo to play as themselves. [Rockstar]",93,8.2
Quake III Arena,id Software,Activision, Dreamcast,2000-10-22,"Prepare to abandon every ounce of common sence and any trace of doubt as you're engulfed by an online multiplayer frnezy throughout cyberspace! Delve into lands of eerie uncertainty and fatal hazards drawing you into the depths of dispair, as legions of foes surround you. Challenging the gut reaction that transported you here in the first place. Immerse yourself within.",93,8.3
Homeworld,Relic Entertainment,Sierra Entertainment, PC,1999-08-31,"Deported to a harsh desert world, exiles have struggled for three thousand years to regain the stars. Now it's up to you to guide them home through a brutal empire bent on annihilation. Homeworld boasts amazing ship graphics and gorgeous deep-space vistas, a unique command and navigation interface and white-knuckle real-time strategy. [Sierra]",93,8.8
Okami,Clover Studio,CAPCOM, PlayStation 2,2006-09-19,"In Okami, the legendary monster Orochi has come back to life and turned the world into a veritable wasteland. Players must assume the role of a wolf, an embodiment of the sun god Amaterasu, which is capable of wielding unimaginable power. The state of the world lies in gamer's hands as they must fight ominous beings and reclaim the earth from a curse that plagues it. It is crucial to help Amaterasu make the world a place where all living creatures can dwell once again. [Capcom]",93,9.1
The Elder Scrolls IV: Oblivion,Bethesda Game Studios,Bethesda Softworks, PlayStation 3,2007-03-20,"Oblivion is a single-player game that takes place in Tamriel's capital province, Cyrodiil. You are given the task of finding the hidden heir to a throne that sits empty, the previous emperor having been killed by an unknown assassin. With no true Emperor, the gates to Oblivion (the equivalent of hell in the world of Tamriel) open, and demons begin to invade Cyrodiil and attack its people and towns. It's up to you to find the lost heir to the throne and unravel the sinister plot that threatens to destroy all of Tamriel. In keeping with the Elder Scrolls tradition, players have the option to experience the main quest at their own pace, and there are plenty of opportunities to explore the vast world and make your own way. Numerous factions can be joined, such as the thieves or mages guilds, and each contains its own complete storyline and the chance to rise to the head of the faction and reap further rewards. Oblivion features a groundbreaking new AI system, called Radiant AI, which gives non-player characters (NPCs) the ability to make their own choices based on the world around them. They decide where to eat or who to talk to and what they say. They sleep, go to church, and even steal items, all based on their individual characteristics. Full facial animations and lip-synching, combined with full speech for all dialog, allows NPCs to come to life like never before. [Bethesda]",93,8.2
Fallout 3,Bethesda Game Studios,Bethesda Softworks, Xbox 360,2008-10-28,"Vault-Tec engineers have worked around the clock on an interactive reproduction of Wasteland life for you to enjoy from the comfort of your own vault. Included is an expansive world, unique combat, shockingly realistic visuals, tons of player choice, and an incredible cast of dynamic characters. Every minute is a fight for survival against the terrors of the outside world – radiation, Super Mutants, and hostile mutated creatures. From Vault-Tec, America's First Choice in Post Nuclear Simulation. Vault 101 - Jewel of the Wastes. For 200 years, Vault 101 has faithfully served the surviving residents of Washington DC and its environs, now known as the Capital Wasteland. Though the global atomic war of 2077 left the US all but destroyed, the residents of Vault 101 enjoy a life free from the constant stress of the outside world. Giant Insects, Raiders, Slavers, and yes, even Super Mutants are all no match for superior Vault-Tec engineering. Yet one fateful morning, you awake to find that your father has defied the Overseer and left the comfort and security afforded by Vault 101 for reasons unknown. Leaving the only home you've ever known, you emerge from the Vault into the harsh Wasteland sun to search for your father, and the truth. [Bethesda Softworks]",93,8.5
Gears of War 2,Epic Games,Microsoft, Xbox 360,2008-11-07,"Gears of War 2 builds upon the gameplay of the first title in every way. First, the scope of the action is bigger: new characters, more weapons, nastier enemies, bigger vehicles, and grander locales offer more action, more emotion, and more thrills. Next, every major aspect of the game has been refined to create heightened, more immersive experiences. Finally, the overall tone of Gears of War 2 is more badass: replete with new weapon-specific executions, chainsaw duels, and shocking boss fights. Gears of War 2 raises the graphics bar for next-generation games through its breathtaking visual effects, which are made possible through advances in Unreal Engine 3. New visual effects include ambient occlusion, dynamic shadows, improved character lighting, the ability to render hundreds of on-screen characters simultaneously, improved water physics, additional blood and bullet decals, advanced destructible environments, new weather effects, and the introduction of fluid objects. When combined with the sweeping vistas and evocative locales in the world of Sera where the Gears of War 2 story unfolds, these additions help make this the most gorgeous game available this generation. Gears of War 2 continues to push deep, immersive storytelling in video games to greater heights. Humanity's epic battle for survival is felt on both the personal and epic levels as you explore multiple story arcs that introduce new characters and flesh out the histories of familiar ones. A new in-game conversational camera system also helps bring the compelling story to life in a cinematic fashion. [Microsoft]",93,7.9
SoulCalibur II,Project Soul,Namco, GameCube,2003-08-27,"Open the next chapter in world of Soul Calibur. Soul Calibur II features seven distinctive gameplay modes including: Arcade, Versus, Time Attack, Survival, Team Battle, Practice, and the console exclusive Weapon Master. Collect up to 200 different weapons and battle characters with their own styles, strengths, and abilities. In addition to the 13 fighters, each platform has unique special fighters: Link for GameCube, Heihachi for PS2, and Spawn for Xbox. Prove yourself through soul and sword.",93,8.9
World Soccer Winning Eleven 6 International,Konami,Konami, PlayStation 2,2003-03-11,"North America, the wait is over. Experience the most realistic virtual recreation of the sport to date. Life-like player models, staggeringly realistic animations, and renowned gameplay bring a soccer experience that can't be beat. This critically acclaimed title is the must have soccer game of the year. Find out what you've been missing. Create your own dream team in the Master League. [Konami]",93,8.4
NFL 2K3,Visual Concepts,Sega, PlayStation 2,2002-08-12,"Get ready for a crowd of new features and improvements, including a completely new Franchise mode, thrilling new offensive and defensive animations, and broadcast-quality commentary regarded as the best in all of sports video games. Complete with all the updated rosters, the new NFL alignment changes, and completely redesigned stadiums, its time to hit the line hard and remember winning isn't a sometime thing: it's an all-time thing. [Sega]",93,7.3
Mass Effect 3,BioWare,Electronic Arts, Xbox 360,2012-03-06,"BioWare completes the Mass Effect Trilogy with Mass Effect 3. Earth is burning. Striking from beyond known space, a race of terrifying machines have begun their destruction of the human race. As Commander Shepard, an Alliance Marine, the only hope for saving mankind is to rally the civilizations of the galaxy and launch one final mission to take back the Earth.",93,6
Hades,Supergiant Games,Supergiant Games, PlayStation 5,2021-08-13,"Defy the god of the dead as you hack and slash out of the Underworld in this rogue-like dungeon crawler from the creators of Bastion, Transistor, and Pyre. Hades is a god-like rogue-like dungeon crawler that combines the best aspects of Supergiant's critically acclaimed titles, including the fast-paced action of Bastion, the rich atmosphere and depth of Transistor, and the character-driven storytelling of Pyre. BATTLE OUT OF HELL. As the immortal Prince of the Underworld, you'll wield the powers and mythic weapons of Olympus to break free from the clutches of the god of the dead himself, while growing stronger and unraveling more of the story with each unique escape attempt. UNLEASH THE FURY OF OLYMPUS The Olympians have your back! Meet Zeus, Athena, Poseidon, and many more, and choose from their dozens of powerful Boons that enhance your abilities. There are thousands of viable character builds to discover as you go. BEFRIEND GODS, GHOSTS, AND MONSTERS A fully-voiced cast of colorful, larger-than-life characters is waiting to meet you! Grow your relationships with them, and experience thousands of unique story events as you learn about what's really at stake for this big, dysfunctional family. BUILT FOR REPLAYABILITY New surprises await each time you delve into the ever-shifting Underworld, whose guardian bosses will remember you. Use the powerful Mirror of Night to grow permanently stronger, and give yourself a leg up the next time you run away from home. NOTHING IS IMPOSSIBLE Permanent upgrades mean you don't have to be a god yourself to experience the exciting combat and gripping story. Though, if you happen to be one, crank up the challenge and get ready for some white-knuckle action that will put your well-practiced skills to the test. SIGNATURE SUPERGIANT STYLE The rich, atmospheric presentation and unique melding of gameplay and narrative that's been core to Supergiant's games is here in full force: spectacular hand-painted environments and a blood-pumping original score bring the Underworld to life.",93,8.4
Metal Gear Solid V: The Phantom Pain,Kojima Productions,Konami, PlayStation 4,2015-09-01,"Following the prologue METAL GEAR SOLID V: GROUND ZEROES, METAL GEAR SOLID V: THE PHANTOM PAIN concludes the METAL GEAR SOLID V experience by following the story of the protagonist of the series, Big Boss (a.k.a. Snake). The METAL GEAR SOLID V experience is Creator and Director Hideo Kojima's first time incorporating open world gameplay to the groundbreaking METAL GEAR franchise.",93,8.2
Skies of Arcadia,Overworks,Sega, Dreamcast,2000-11-13,"The age of exploration has dawned and you are about to embark on a magical journey, a voyage of discovery across the vast Skies of Arcadia in search of treasures untold, and where there is treasure, there will be Air Pirates! With over six vast lands to navigate, magnificent ships to fly and customize, a host of weapons and magical spells to be discovered and unique Internet functions to aid your quest, Skies of Arcadia is the most immense gaming experience ever created.",93,8.9
The Legend of Zelda: Skyward Sword,Nintendo,Nintendo, Wii,2011-11-20,"A Link to the Future - The Legend of Zelda: Skyward Sword shakes up the tried-and-true adventure game formula and marks a turning point for the franchise. The introduction of full motion controls enabled by Wii MotionPlus technology synchronizes player movements with Link's actions while offering the most intuitive play control of any game in the series to date. FEATURES: * The Legend of Zelda: Skyward Sword boasts the most realistic sword combat of any game to date, turning every encounter into a challenge of both brains and brawn. Wii MotionPlus technology accurately translates the angle of every sword slice, effectively putting Link's blade in the player's hand. Analyzing enemy attack and defense tendencies and counteracting with precise swings of the sword provide a satisfying experience that blends puzzle-solving with a new and distinctly unique combat system. * Explore a massive, multilayered world that seamlessly blends soaring exploration in a sea of clouds with intense ground-based adventuring that blurs the line between the main world and traditional Zelda dungeons. Link soars through the skies on the back of a noble bird and dives beneath the clouds to the continent below in an epic quest that lays the foundation for the events in the critically acclaimed The Legend of Zelda: Ocarina of Time. * Prepare for intense puzzle-solving as only The Legend of Zelda games can deliver. Exploration of the forests, volcanoes and deserts requires players to think on their feet as they solve puzzles, overcome obstacles and escape deadly traps. Once they find their way to each dungeon, they are confronted by even more puzzles guarded by fiendish enemies. * The Legend of Zelda: Skyward Sword redefines the traditional Zelda framework and introduces an arsenal of items, upgrades and rewards unlike any game in the franchise to date. The adventure guides players into, out of and back to dungeons and areas they've already completed. Along the way, Link gathers a massive inventory of peculiar items and resources that can be used to upgrade many of his weapons and equipment. * Every copy in the initial production of the game will come packaged with a special music CD featuring orchestral arrangements of select songs that will be performed at The Legend of Zelda 25th Anniversary Symphony Concert. * This version of The Legend of Zelda: Skyward Sword comes packaged with a special Gold Wii Remote Plus controller. You can also purchase a copy of the game without a controller.",93,8.1
