name,developer,publisher,platform,release_date,summary,meta_score,user_review
Tekken 3,Namco,Namco, PlayStation,1998-04-29,"An ancient evil force has reawakened, attacking in secret and feeding on the souls of mighty warriors. To lure it out of hiding will take the greatest fighting contest the world has ever seen...Tekken 3. Some are fighting for revenge, some for honor, Ultimately, all are fighting for their lives and the fate of all mankind.",96,9.1
Mass Effect 2,BioWare,Electronic Arts, Xbox 360,2010-01-26,"The Mass Effect trilogy is a science fiction adventure set in a vast universe filled with dangerous alien life forms and mysterious uncharted planets. In this dark second chapter, Saren’s evil army of Geth soldiers has just been defeated, and humans, who are still struggling to make their mark on the galactic stage, are now faced with an even greater peril. [BioWare]",96,8.9
The Legend of Zelda: Twilight Princess,Nintendo,Nintendo, GameCube,2006-12-11,"In the next chapter in the Legend of Zelda series, Link can transform into a wolf to scour the darkened land of Hyrule. With the help of Midna, a mysterious being, you must guide Link through hordes of foul creatures and challenging bosses using new moves and a new horseback combat system. Many puzzles stand between Link and the fulfillment of his quest, so you must sharpen your wits as you hunt for weapons and items.",96,8.9
The Elder Scrolls V: Skyrim,Bethesda Game Studios,Bethesda Softworks, Xbox 360,2011-11-11,"The next chapter in the Elder Scrolls saga arrives from the Bethesda Game Studios. Skyrim reimagines the open-world fantasy epic, bringing to life a complete virtual world open for you to explore any way you choose. Play any type of character you can imagine, and do whatever you want; the legendary freedom of choice, storytelling, and adventure of The Elder Scrolls is realized like never before. Skyrim's new game engine brings to life a complete virtual world with rolling clouds, rugged mountains, bustling cities, lush fields, and ancient dungeons. Choose from hundreds of weapons, spells, and abilities. The new character system allows you to play any way you want and define yourself through your actions. Battle ancient dragons like you've never seen. As Dragonborn, learn their secrets and harness their power for yourself.",96,8.6
Half-Life,Valve,Sierra Entertainment, PC,1998-11-19,"Half-Life combines great storytelling in the tradition of Stephen King with intense action and advanced technology to create a frighteningly realistic world where players need to think smart to survive. Half-Life has won more than 50 Game of the Year awards from publications around the world, and was named 'Best PC Game Ever' in PC Gamer's November 1999 issue. [Sierra]",96,9.1
Resident Evil 4,CAPCOM,CAPCOM, PlayStation 2,2005-10-25,"In Resident Evil 4 players are reacquainted with Leon S. Kennedy, Raccoon City Police Department's idealistic rookie cop from ""Resident Evil 2."" It has been six years since the destruction of Raccoon City and in that time, the U.S. government has been able to destroy the nefarious Umbrella Corporation. Fast forward to 2004 and players rejoin Leon, who is now a U.S. agent with a top-secret mission. He has been tasked to look into the abduction of the President's daughter and his investigation has led him to a mysterious location in Europe. As Leon encounters unimaginable horrors, he must find out who or what is behind everything. [Capcom]",96,9
The Legend of Zelda: The Wind Waker,Nintendo,Nintendo, GameCube,2003-03-24,"In this ninth entry in the Legend of Zelda series, Link debuts on GameCube with a fun new cel-shaded look, but the game stays true to the respected heritage of the series. The classic mix of sword-swinging action, perplexing puzzles and stirring story lines remains intact, but the stunning cel-shaded graphics give the people and places of Link's watery world a wildly artistic new look. And for the very first time, Link sails freely on the high seas. Join Link on his most epic and scenic adventure yet. Face unimaginable monsters, explore puzzling dungeons, and meet a cast of unforgettable characters as he searches for his kidnapped sister, Aryll.",96,9
Gran Turismo,Japan Studio,Sony Computer Entertainment, PlayStation,1998-04-30,"Welcome to the most advanced racing game ever created! Encounter exhilarating high-speed racing in 11 stunning environments. Feel handling agility and throttle response so convincing, the car seems to be an extension of yourself. Experience the extraordinary world of Gran Turismo!",96,8.6
BioShock,2K Boston,2K, PC,2007-08-21,"Going beyond ""run and gun corridors,"" ""monster-closet AIs"" and static worlds, BioShock creates a living, unique and unpredictable FPS experience. After your plane crashes into icy uncharted waters, you discover a rusted bathysphere and descend into Rapture, a city hidden beneath the sea. Constructed as an idealistic society for a hand picked group of scientists, artists and industrialists, the idealism is no more. Now the city is littered with corpses, wildly powerful guardians roam the corridors as little girls loot the dead, and genetically mutated citizens ambush you at every turn. Take control of your world by hacking mechanical devices, commandeering security turrets and crafting unique items critical to your very survival. Upgrade your weapons with ionic gels, explosives and toxins to customize them to the enemy and environment. Genetically modify your body through dozens of Plasmid Stations scattered throughout the city, empowering you with fantastic and often grotesque abilities. Explore a living world powered by Ecological A.I., where the inhabitants have interesting and consequential relationships with one another that impact your gameplay experience. Experience truly next generation graphics that vividly illustrate the forlorn art deco city, highlighted by the most detailed and realistic water effects ever developed in a video game. Make meaningful choices and mature decisions, ultimately culminating in the grand question: do you exploit the innocent survivors of Rapture...or save them? [2K Games]",96,8.6
Metal Gear Solid 2: Sons of Liberty,Konami,Konami, PlayStation 2,2001-11-12,"Since the incident on Shadow Moses Island, Metal Gear's top-secret technology has been leaked into the black market through the machinations of Revolver Ocelot. As a result, countless variations of Metal Gears have sprung up in every corner of the globe, making the weapon an increasingly common component of the armed forces of nuclear powers. In the midst of all of this, Solid Snake, now a member of the anti-Metal Gear group ""Philanthropy,"" has learned that a new prototype Metal Gear has been developed by the U.S. Marines and is being transported in secret to an unknown destination. To learn more about this new machine, Snake must infiltrate the transport, disguised as a tanker, as it makes its way down the Hudson River. Just as Snake is about to begin his mission, however, the ship is seized by a mysterious and well-armed group bent on stealing the new Metal Gear for their own, nefarious purposes. [Konami]",96,8.8
Grand Theft Auto Double Pack,Rockstar Games,Rockstar Games, Xbox,2003-10-31,"From the dark and seedy streets of Liberty City's underworld to the glamorous hedonism of Vice City of the 1980s, the Grand Theft Auto double-pack takes you through the huge worlds of Grand Theft Auto III and it's sequel Vice City. The highly controversial Grand Theft Auto III gives you the freedom to go anywhere and jack anyone, putting the dark, intriguing and ruthless world of crime at your fingertips. Vice City is an entirely new game set in the '80s, preserving and adding to the free-roaming gameplay, cinematic graphics and immersive audio experience that made the Grand Theft Auto III so popular.",96,8.1
Baldur's Gate II: Shadows of Amn,BioWare,Interplay Entertainment, PC,2000-09-24,"An epic continuation of the story that began in ""Baldur's Gate,"" this RPG is set along the southern portion of the Sword Coast, a detailed and rich area of the Forgotten Realms called Amn. It features 300 spells and 130-plus monster types compared to only 130 spells and 60 monster types in Baldur's Gate. [Interplay]",95,9.1
Grand Theft Auto: San Andreas,Rockstar Games,Rockstar Games, PlayStation 2,2004-10-26,"[Metacritic's 2004 PS2 Game of the Year] Five years ago Carl Johnson escaped from the pressures of life in Los Santos, San Andreas... a city tearing itself apart with gang trouble, drugs and corruption. Where filmstars and millionaires do their best to avoid the dealers and gangbangers. Now, it's the early 90s. Carl's got to go home. His mother has been murdered, his family has fallen apart and his childhood friends are all heading towards disaster. On his return to the neighborhood, a couple of corrupt cops frame him for homicide. CJ is forced on a journey that takes him across the entire state of San Andreas, to save his family and to take control of the streets. [Rockstar]",95,9.1
Grand Theft Auto: Vice City,Rockstar Games,Rockstar Games, PlayStation 2,2002-10-27,"[Metacritic's 2002 PS2 Game of the Year ] Welcome to Vice City. Welcome to the 1980s. Having just made it back onto the streets of Liberty City after a long stretch in maximum security, Tommy Vercetti is sent to Vice City by his old boss, Sonny Forelli. They were understandably nervous about his re-appearance in Liberty City, so a trip down south seemed like a good idea. But all does not go smoothly upon his arrival in the glamorous, hedonistic metropolis of Vice City. He's set up and is left with no money and no merchandise. Sonny wants his money back, but the biker gangs, Cuban gangsters, and corrupt politicians stand in his way. Most of Vice City seems to want Tommy dead. His only answer is to fight back and take over the city himself. Vice City offers vehicular pleasures to suit every taste. For the speed enthusiast, there's high-performance cars and motorbikes. For the sportsman, a powerboat or a golf buggy lets you enjoy the great outdoors. For those that need that sense of freedom and escape, why not charter a helicopter and see the beauty of Vice City from the air? [Rockstar]",95,8.8
LittleBigPlanet,Media Molecule,Sony Computer Entertainment, PlayStation 3,2008-10-27,"In LittleBigPlanet Players meet on a blue and green planet scattered with individual plots – and use their character's amazing abilities to play, create and share what they build with other gamers throughout the world via the Playstation Network. The LittleBigPlanet experience starts with players learning about their character’s powers to interact physically with the environment. There are places to explore, creative resources to collect and puzzles to solve – all requiring a combination of brains and collaborative teamwork. As soon as players begin their creative skills will grow and they will soon be ready to start creating and modifying their surroundings – the first step to sharing them with the whole community.Characters have the power to move anything in this glued and stitched-together 3D landscape; they have the power to design, shape and build both objects and entire locations for others to view and play. There’s no complicated level editor; all of these skills can be learned by simply playing the game. Creativity is part of the gameplay experience and playing is part of the creative experience. Players can make their world as open or as secretive to explore as they like. When it’s ready, they can invite anyone within the LittleBigPlanet community to come and explore their patch – or can go and explore everybody else's. [SCEA]",95,6.8
The Legend of Zelda Collector's Edition,Nintendo,Nintendo, GameCube,2003-11-17,"Receive Four Complete Classic Zelda games all on one disc when you buy the Zelda GameCube Bundle: The Legend of Zelda, Zelda II - The adventure of Link, The Legend of Zelda: Ocarina of Time, The Legend of Zelda: Majora's Mask. The disc also includes: Playable Demo of the Legend of Zelda: The Wind Waker, Zelda Retrospective Movie, The Legend of Zelda: The Wind Waker Movie Preview.",95,8.9
Red Dead Redemption,Rockstar Games,Rockstar Games, PlayStation 3,2010-05-18,"Developed by Rockstar San Diego, as a follow up to the 2004 hit game Red Dead Revolver, Red Dead Redemption is a Western epic, set at the turn of the 20th century when the lawless and chaotic badlands began to give way to the expanding reach of government and the spread of the Industrial Age. The story of former outlaw, John Marston, Red Dead Redemption takes players on a great adventure across the American frontier. Utilizing Rockstar's proprietary Rockstar Advanced Game Engine (RAGE), Red Dead Redemption features an open-world environment for players to explore, including frontier towns, rolling prairies teeming with wildlife, and perilous mountain passes - each packed with an endless flow of varied distractions. Along the way, players experience the heat of gunfights and battles, meet a host of unique characters, struggle against the harshness of one of the world’s last remaining wildernesses, and ultimately pick their own precarious path through an epic story about the death of the Wild West and the gunslingers that inhabited it. [Rockstar Games]",95,8.9
Gran Turismo 3: A-Spec,Polyphony Digital,Sony Computer Entertainment, PlayStation 2,2001-07-09,"With the addition of two new courses (a downtown Tokyo circuit and the Monte Carlo Grand Prix course), an impressive range of cars (from Vipers to Cooper Minis), and a soundtrack featuring everything from Lenny Kravitz to Jimi Hendrix, this highly anticipated title is finally ready to be driven.",95,8.4
Halo 2,Bungie,Microsoft, Xbox,2004-11-09,"The Covenant alien race threatens to destroy all humankind, and the only thing standing in its way is Master Chief, a genetically enhanced supersoldier. Master Chief returns in Halo 2, which features new vehicles, weapons, environments, and more. This time, you can interact with your environment, wield two weapons at the same time, board opponents' vehicles, and even switch sides to play the role of a Covenant Elite. Halo 2 also supports broadband multiplayer action via Xbox Live.",95,8.7
The Legend of Zelda: A Link to the Past,Nintendo,Nintendo, Game Boy Advance,2002-12-03,"Now you have a link to one of the greatest adventures in The Legend of Zelda series. The Legend of Zelda: A Link to the Past revives the classic SNES game on the Game Boy Advance and adds a new multiplayer mode. In a Link to the Past, Link travels between the light world and the dark world, conquering fierce monsters and uncovering Hyrule's deepest secrets along the way. Also included is Four Swords, which lets you play with up to three other players, slashing through dungeons and collecting rupees. Whether you choose solo or competitive play, The Legend of Zelda will keep you occupied with its brain-bending puzzles and fun swashbuckling action.",95,9
The Legend of Zelda: Majora's Mask,Nintendo,Nintendo, Nintendo 64,2000-10-25,"Thrown into a parallel world by the mischievous actions of a possessed Skull Kid, Link finds a land in grave danger. The dark power of a relic called Majora's Mask has wreaked havoc on the citizens of Termina, but their most urgent problem is a suicidal moon crashing toward the world. Link has only 72 hours to find a way to stop its descent.",95,9.1
The Last of Us,Naughty Dog,Sony Computer Entertainment, PlayStation 3,2013-06-14,"Twenty years after a pandemic radically transformed known civilization, infected humans run amuck and survivors kill one another for sustenance and weapons - literally whatever they can get their hands on. Joel, a salty survivor, is hired to smuggle a fourteen-year-old girl, Ellie, out of a rough military quarantine, but what begins as a simple job quickly turns into a brutal journey across the country.",95,9.2
The Legend of Zelda: Twilight Princess,Nintendo,Nintendo, Wii,2006-11-19,"When an evil darkness enshrouds the land of Hyrule, a young farm boy named Link must awaken the hero - and the animal - within. When Link travels to the Twilight Realm, he transforms into a wolf and must scour the land with the help of a mysterious girl named Midna. Using the power and unique control of the Wii console, The Legend of Zelda: Twilight Princess features precise aiming control using the Wii Remote. The Wii Remote and the Nunchuk controller are used for a variety of game activities, including fishing and special sword attacks. Players ride into battle against troops of foul creatures using an amazing horseback combat system, then take on massive bosses that must be seen to be believed. [Nintendo]",95,9
Madden NFL 2003,EA Tiburon,EA Sports, PlayStation 2,2002-08-12,"Take Your Game Online: Access an online community where you can meet, chat, and play head-to-head against other gamers. Audio Dream Team: Dynamic play-by-play and analysis by Madden and Michaels. All-New Mini-camp: Hop on John Madden's Cruiser Tour Bus and travel to all NFL cities to complete skilled tasks. Create-A-Playbook: Customize receiver routes, player formations, and your team's entire playbook. Deepest Franchise Mode Ever: Play 30 years of Franchise mode and draft players each season with tips from your scouts. [EA Sports]",95,7.6
Tony Hawk's Pro Skater 2,Neversoft,Activision, Game Boy Advance,2001-05-30,"Hawks back, in the worlds first 3D handheld skating game, and hes brought new pros (Caballero, Koston, Mullen), New tricks (Bluntsides, BS/FS Nose-and Tailsides, Heelflip Varials, Airwalks, and more), and new terrain (Insane street and vert levels) Tony Hawks Pro Skater 2 for Game Boy Advance. Get your hands on a legend.",95,6.9
Persona 5 Royal,P-Studio,Atlus, PlayStation 4,2020-03-31,"Prepare for an all-new RPG experience in Persona 5 Royal based in the universe of the award-winning series, Persona! Don the mask of Joker and join the Phantom Thieves of Hearts. Break free from the chains of modern society and stage grand heists to infiltrate the minds of the corrupt and make them change their ways! Persona 5 Royal is packed with new characters, confidants, story depth, new locations to explore, and a new grappling hook mechanic for stealthy access to new areas. With a new semester at Shujin Academy, get ready to strengthen your abilities in the metaverse and in your daily life. Persona 5 Royal presents a unique visual style and award nominated composer Shoji Meguro returns with an all-new soundtrack. Explore Tokyo, unlock new Personas, customize your own personal Thieves Den, discover a never-before-seen story arc, cutscenes, alternate endings, and more! Even for the most seasoned Phantom Thieves among us, Persona 5 Royal is a new challenge to defy conventions, discover the power within, and fight for justice. Wear the mask. Reveal your truth.",95,8.4
The Last of Us Remastered,Naughty Dog,Sony Computer Entertainment, PlayStation 4,2014-07-29,"The Last of Us has been rebuilt for the PlayStation4 system. Now featuring full 1080p, higher resolution character models, improved shadows and lighting, in addition to several other gameplay improvements. 20 years after a pandemic has radically changed known civilization, infected humans run wild and survivors are killing each other for food, weapons; whatever they can get their hands on. Joel, a violent survivor, is hired to smuggle a 14 year-old girl, Ellie, out of an oppressive military quarantine zone, but what starts as a small job soon transforms into a brutal journey across the U.S. The Last of Us Remastered includes the Abandoned Territories Map Pack, Reclaimed Territories Map Pack, and the critically acclaimed The Last of Us: Left Behind Single Player campaign that combines themes of survival, loyalty, and love with tense, survival-action gameplay. Remastered Features: -Explore a brutal post-pandemic world, fully realized with the power of PlayStation4 system -Includes additional game content: over $30 in value -Delve into Ellies past in Left Behind, the single-player prequel chapter -Eight new multiplayer maps in the Abandoned and Reclaimed Territories packs -In-game cinematic commentary from the cast and creative director",95,9.2
Tetris Effect: Connected,Monstars,Enhance Games, Switch,2021-10-08,"Tetris Effect: Connected is the original Tetris Effect with all-new co-op and competitive online and local multiplayer modes. This is Tetris like you've never seen it, or heard it, or felt it beforean incredibly addictive, unique and breathtakingly gorgeous reinvention of one of the most popular puzzle games of all time.",95,8.5
Portal 2,Valve,Valve, PC,2011-04-18,"Valve is working on a full-length sequel to its award-winning, mind-bending puzzle action game for the Xbox 360 and PC.",95,9.1
Red Dead Redemption,Rockstar Games,Rockstar Games, Xbox 360,2010-05-18,"Developed by Rockstar San Diego, as a follow up to the 2004 hit game Red Dead Revolver, Red Dead Redemption is a Western epic, set at the turn of the 20th century when the lawless and chaotic badlands began to give way to the expanding reach of government and the spread of the Industrial Age. The story of former outlaw, John Marston, Red Dead Redemption takes players on a great adventure across the American frontier. Utilizing Rockstar's proprietary Rockstar Advanced Game Engine (RAGE), Red Dead Redemption features an open-world environment for players to explore, including frontier towns, rolling prairies teeming with wildlife, and perilous mountain passes - each packed with an endless flow of varied distractions. Along the way, players experience the heat of gunfights and battles, meet a host of unique characters, struggle against the harshness of one of the world’s last remaining wildernesses, and ultimately pick their own precarious path through an epic story about the death of the Wild West and the gunslingers that inhabited it. [Rockstar Games]",95,9
Portal 2,Valve,Valve, Xbox 360,2011-04-19,"Valve is working on a full-length sequel to its award-winning, mind-bending puzzle action game for the Xbox 360 and PC.",95,8.8
Metal Gear Solid V: The Phantom Pain,Kojima Productions,Konami, Xbox One,2015-09-01,"Following the prologue METAL GEAR SOLID V: GROUND ZEROES, METAL GEAR SOLID V: THE PHANTOM PAIN concludes the METAL GEAR SOLID V experience by following the story of the protagonist of the series, Big Boss (a.k.a. Snake). The METAL GEAR SOLID V experience is Creator and Director Hideo Kojima's first time incorporating open world gameplay to the groundbreaking METAL GEAR franchise.",95,7.5
Portal 2,Valve,Valve, PlayStation 3,2011-04-19,"Portal 2 is the sequel to the title named ""Game of the Year"" 2007 by over 30 publications around the world. Portal 2 promises to break new ground in next generation gaming by expanding the award-winning recipe of innovative gameplay, immersive story, and creative inclusion of music while also introducing multiplayer co-op game modes.",95,8.7
World of Goo,2D Boy,2D Boy, Wii,2008-10-13,"[WiiWare] World of Goo is a physics based puzzle / construction game. The millions of Goo Balls that live in the beautiful World of Goo don't know that they are in a game, or that they are extremely delicious. [2D Boy]",94,8.7
The Elder Scrolls V: Skyrim,Bethesda Game Studios,Bethesda Softworks, PC,2011-11-10,"The next chapter in the Elder Scrolls saga arrives from the Bethesda Game Studios. Skyrim reimagines the open-world fantasy epic, bringing to life a complete virtual world open for you to explore any way you choose. Play any type of character you can imagine, and do whatever you want; the legendary freedom of choice, storytelling, and adventure of The Elder Scrolls is realized like never before. Skyrim's new game engine brings to life a complete virtual world with rolling clouds, rugged mountains, bustling cities, lush fields, and ancient dungeons. Choose from hundreds of weapons, spells, and abilities. The new character system allows you to play any way you want and define yourself through your actions. Battle ancient dragons like you've never seen. As Dragonborn, learn their secrets and harness their power for yourself.",94,8.4
BioShock Infinite,Irrational Games,2K, PlayStation 3,2013-03-26,"Once conceived as a floating symbol of American ideals at a time when the United States was emerging as a world power, Columbia has been dispatched to distant shores with great fanfare by a captivated public. What begins as a brand new endeavor of hope turns drastically wrong as the city soon disappears into the clouds to whereabouts unknown. The player assumes the role of former Pinkerton agent Booker DeWitt, sent to the lost city to rescue Elizabeth, a young woman imprisoned there since childhood. He develops a relationship with Elizabeth, augmenting his abilities with hers so the pair may escape from a city that is literally falling from the sky. DeWitt must learn to fight foes in high-speed Sky-Line battles, engage in combat both indoors and amongst the clouds, and engage the power of dozens of new weapons and abilities.",94,8.5
Final Fantasy IX,Square,Square Enix, PlayStation,2000-11-13,"The last Final Fantasy for the PlayStation, Final Fantasy IX returns to the pure fantasy roots that spawned the series. This latest installment features highly detailed characters, vehicles, and environments, and breathtaking cinema-graphics. The addition of brand new features such as the story-enhancing Active Time Event system and the return of minigames that grant additional gameplay make Final Fantasy IX not only a memorable gaming experience, but also a significant step forward in the series.",94,9
