name,developer,publisher,platform,release_date,summary,meta_score,user_review
Call of Duty: Modern Warfare 2,Infinity Ward,Activision, PlayStation 3,2009-11-10,"Modern Warfare 2 continues the gripping and heart-racing action as players face off against a new threat dedicated to bringing the world to the brink of collapse. An entirely new gameplay mode which supports 2-player co-operative play online that is unique from the single player story campaign. Special Ops pits players into a gauntlet of time-trial and objective-based missions. Rank-up as players unlock new Special Ops missions, each more difficult. Missions include highlights from the single player campaign, fan favorites from Call of Duty 4: Modern Warfare and all new, exclusive missions. Setting a new bar for online multiplayer, Modern Warfare 2 multiplayer delivers new capabilities, customization, gamestates and modes, including: Create-a-Class Evolved. Secondary Weapons - Machine Pistols, Shotguns, Handguns, Launchers. Riot Shields. Equipment - Throwing Knives, Blast Shield, Tactical Insertion. Perk Upgrades. Bling (Dual Attachments). Customizable Killstreaks - AC130, Sentry Gun, Predator Missile, Counter-UAV, Care Package. Accolades (Post match reports). [Activision]",94,6.6
God of War,Santa Monica Studio,Sony Interactive Entertainment, PlayStation 4,2018-04-20,"His vengeance against the gods of Olympus far behind him, Kratos now lives as a man in the lands of Norse Gods and monsters. It is in this harsh, unforgiving world that he must fight to survive… and teach his son to do the same. As mentor and protector to a son determined to earn his respect, Kratos is faced with an unexpected opportunity to master the rage that has long defined him. Questioning the dark lineage he’s passed on to his son, he hopes to make amends for the shortcomings of his past. Set within the untamed forests, mountains, and realms of Norse lore, God of War features a distinctly new setting with its own pantheon of creatures, monsters, and gods. [Playstation.com]",94,9.2
Tony Hawk's Pro Skater 4,Neversoft,Activision, PlayStation 2,2002-10-23,"Build your skills, earn respect, and show that you've got what it takes to Go Pro. 190 progressively harder goals. No time clock, no constraints. Pro-specific challenges. Evolving levels. Interact with other skaters. Multi-player modes. Customize your game...Your career is what you make of it. [Activision]",94,8.4
Devil May Cry,CAPCOM,CAPCOM, PlayStation 2,2001-10-16,"In a large American metropolis, a man named Dante, a private investigator of the supernatural, is seeking revenge for the death of his mother and brother. The world is waiting, for Dante is no ordinary man, and with his father's sword in hand, he must enter the demon realm and avenge mankind. [Capcom]",94,8.6
Call of Duty 4: Modern Warfare,Infinity Ward,Activision, PlayStation 3,2007-11-05,"[Metacritic's 2007 PS3 Game of the Year] As Call of Duty 4: Modern Warfare's single player campaign unfolds, the player is introduced to new gameplay at every turn – one moment you are fast-roping from your Black Hawk helicopter after storming into the war zone with an armada of choppers, the next you are a sniper, under concealment, in a Ghillie suit miles behind enemy lines, the next you are engaging hostiles from an AC-130 gunship thousands of feet above the battlefield. Mixed with explosive action, Call of Duty 4: Modern Warfare also delivers special effects, including use of depth of field, rim-lighting, character self-shadowing, real time post-processing, texture streaming as well as physics-enabled effects. Infinity Ward deployed a dedicated team from the start to deliver a new level of depth to multiplayer. Building on the hit ""Call of Duty 2"" online experience, Call of Duty 4: Modern Warfare's new multiplayer provides the community an addictive and accessible experience to gamers of all levels. [Activision]",94,8.4
Madden NFL 2002,EA Tiburon,EA Sports, PlayStation 2,2001-08-19,"The industry football standard returns featuring the Houston Texans, new player face and body technology, the ability to create your own team with custom helmets, uniforms, and stadiums, and a new training mode that let's you learn from Madden, the master himself.",94,7.3
Batman: Arkham City,Rocksteady Studios,Warner Bros., Xbox 360,2011-10-18,"Developed by Rocksteady Studios, Batman: Arkham City builds upon the intense, atmospheric foundation of Batman: Arkham Asylum, sending players soaring into Arkham City, the new maximum security ""home"" for all of Gotham City's thugs, gangsters and insane criminal masterminds. Set inside the heavily fortified walls of a sprawling district in the heart of Gotham City, this highly anticipated sequel introduces a brand-new story that draws together a new all-star cast of classic characters and murderous villains from the Batman universe, as well as a vast range of new and enhanced gameplay features to deliver the ultimate experience as the Dark Knight.",94,8.8
Mass Effect 2,BioWare,Electronic Arts, PC,2010-01-26,"The Mass Effect trilogy is a science fiction adventure set in a vast universe filled with dangerous alien life forms and mysterious uncharted planets. In this dark second chapter, Saren’s evil army of Geth soldiers has just been defeated, and humans, who are still struggling to make their mark on the galactic stage, are now faced with an even greater peril. [BioWare]",94,8.9
The Legend of Zelda: Ocarina of Time 3D,Grezzo,Nintendo, 3DS,2011-06-19,"The Legend of Zelda: Ocarina of Time 3D takes the best-reviewed game of all time for a brand-new experience. Now in 3D all of the graphic textures and colors have been vastly improved, taking advantage of the considerable graphic power of the Nintendo 3DS system. This game tells the epic story of Hyrule and Link™, Zelda™, and Ganondorf in remarkable depth and gives context to the many tales of their struggles. As such, this title represents a perfect entry point for players new to the Zelda franchise. Phenomenally Improved Graphics Beyond even the incredible 3D effect, every graphic texture and character model has been lovingly built from the ground up to create the most dynamic and vivid vision of Zelda’s kingdom yet. This is Hyrule as you’ve always imagined it. Playing the Ocarina Link needs to play the eponymous Ocarina of Time many, many times over the course of the game. This involves a specific series of button presses to play one of the twelve songs in the game. In the original title, you would need to assign the ocarina to an item slot, then likely review the button prompts to your song, then play them from memory. The Nintendo 3DS version has the ocarina constantly available on the Touch Screen, and playing with the button prompts for each song right in front of you. Enhanced Game play While the greatest care has been taken to preserve the classic game play and story, a number of new features make this the definitive version of this extraordinary game.",94,9
Chrono Cross,Square,Square Enix, PlayStation,2000-08-15,"Featuring a storyline developed by the creator of Chrono Trigger and Xenogears, Chrono Cross has been christened the ""Best RPG Creation"" by its development team. With multiple scenarios cast along a single story thread, and many different endings, each replay can result in an entirely new adventure. In addition, a brand new battle system makes combat smooth and innovative by introducing an element field system and combo system that gives the player unparalleled flexibility in their fighting options. The elimination of random battles also quickens the pace of the game, and places the choice of where to battle in the player's hands. With character designs by a famed Japanese illustrator and music by the original Chrono Trigger composer, Chrono Cross features visuals and sounds that bring its magic to life.",94,8.8
Celeste,Maddy Makes Games,Maddy Makes Games, Xbox One,2018-01-26,"Help Madeline survive her journey to the top of Celeste Mountain in this super-tight, hand-crafted platformer from the creators of TowerFall.",94,7.4
BioShock,2K Boston,2K, PlayStation 3,2008-10-21,"Going beyond ""run and gun corridors,"" ""monster-closet AIs"" and static worlds, BioShock creates a living, unique and unpredictable FPS experience. After your plane crashes into icy uncharted waters, you discover a rusted bathysphere and descend into Rapture, a city hidden beneath the sea. Constructed as an idealistic society for a hand picked group of scientists, artists and industrialists, the idealism is no more. Now the city is littered with corpses, wildly powerful guardians roam the corridors as little girls loot the dead, and genetically mutated citizens ambush you at every turn. Take control of your world by hacking mechanical devices, commandeering security turrets and crafting unique items critical to your very survival. Upgrade your weapons with ionic gels, explosives and toxins to customize them to the enemy and environment. Genetically modify your body through dozens of Plasmid Stations scattered throughout the city, empowering you with fantastic and often grotesque abilities. Explore a living world powered by Ecological A.I., where the inhabitants have interesting and consequential relationships with one another that impact your gameplay experience. Experience truly next generation graphics that vividly illustrate the forlorn art deco city, highlighted by the most detailed and realistic water effects ever developed in a video game. Make meaningful choices and mature decisions, ultimately culminating in the grand question: do you exploit the innocent survivors of Rapture...or save them? [2K Games]",94,8.9
Mass Effect 2,BioWare,Electronic Arts, PlayStation 3,2011-01-17,"The Mass Effect trilogy is an emotionally charged science fiction adventure set in a vast universe filled with dangerous alien life and mysterious, uncharted planets. In Mass Effect 2, players will once again step into the role of the heroic Commander Shepard, commanding their crew of some of the most dangerous operatives from across the galaxy on a mission so challenging that it's potentially suicidal. Featuring intense shooter action, a rich futuristic storyline, space exploration and emotionally engaging character interaction, the game delivers an unparalleled cinematic experience.",94,8.7
Grand Theft Auto: Vice City,Rockstar Games,Rockstar Games, PC,2003-05-12,"[Metacritic's 2003 PC Game of the Year] The PC version has enhanced features including improved graphics and sound, additional PC controls, as well as several options for players to customize the game. ""Welcome to Vice City. Welcome to the 1980s."" Having just made it back onto the streets of Liberty City after a long stretch in maximum security, Tommy Vercetti is sent to Vice City by his old boss, Sonny Forelli. They were understandably nervous about his re-appearance in Liberty City, so a trip down south seemed like a good idea. But all does not go smoothly upon his arrival in the glamorous, hedonistic metropolis of Vice City. He's set up and is left with no money and no merchandise. Sonny wants his money back, but the biker gangs, Cuban gangsters, and corrupt politicians stand in his way. Most of Vice City seems to want Tommy dead. His only answer is to fight back and take over the city himself. Vice City offers vehicular pleasures to suit every taste. For the speed enthusiast, there's high-performance cars and motorbikes. For the sportsman, a powerboat or a golf buggy lets you enjoy the great outdoors. For those that need that sense of freedom and escape, why not charter a helicopter and see the beauty of Vice City from the air? [Rockstar]",94,8.8
Madden NFL 2004,EA Tiburon,EA Sports, PlayStation 2,2003-08-12,"[Metacritic's 2003 Playstation 2 Game of the Year] Key Features for 2004 include New Playmaker Control - Make pre-snap adjustments to your receiver routes, direct receiver routes during a scramble, direct blocking down field during a run, or read and react to the offense to deliver a crushing tackle; New Owner Mode - Hire your own staff, set your team's ticket prices, build your own stadium, reward key players with signing bonuses and boost player attributes in Mini-Camp drills; Most Realistic NFL Playbooks Ever - Tons of new trick plays, multiple formation variations, and the deepest NFL playbooks from all 32 officially licensed Coaches Club Head Coaches; New Animations and Enhancements - New QB scramble transitions to improve throwing on the run, stumbles, open field blocks, whirlwind defensive reaction moves, sideline wrap tackles, and out of bound pushes. [Electronic Arts]",94,8.3
Gears of War,Epic Games,Microsoft, Xbox 360,2006-11-07,"Gears of War blends tactical action with survival horror and thrusts gamers into a deep and harrowing story of humankind's epic battle for survival against the Locust Horde, a nightmarish race of creatures that surface from the bowels of the planet. Lead war hero Marcus Fenix and his fire team as they face the onslaught of merciless warrior fiends. A revolutionary tactical combat system and breathtaking, high-definition visuals from the Unreal Engine 3 immerse you in a horrifying story of war and survival. A.I. teammates are indiscernable from human players. Voice recognition and real-time lip synching heighten the experience. The battlefield is a lethal place. To survive, suppress your enemy with blindfire, take cover in interactive environments, or use weapons and teammates to outwit your foes. [Microsoft]",94,8.4
The Elder Scrolls IV: Oblivion,Bethesda Game Studios,Bethesda Softworks, Xbox 360,2006-03-20,"Oblivion is a single-player game that takes place in Tamriel's capital province, Cyrodiil. You are given the task of finding the hidden heir to a throne that sits empty, the previous emperor having been killed by an unknown assassin. With no true Emperor, the gates to Oblivion (the equivalent of hell in the world of Tamriel) open, and demons begin to invade Cyrodiil and attack its people and towns. It's up to you to find the lost heir to the throne and unravel the sinister plot that threatens to destroy all of Tamriel. In keeping with the Elder Scrolls tradition, players have the option to experience the main quest at their own pace, and there are plenty of opportunities to explore the vast world and make your own way. Numerous factions can be joined, such as the thieves or mages guilds, and each contains its own complete storyline and the chance to rise to the head of the faction and reap further rewards. Oblivion features a groundbreaking new AI system, called Radiant AI, which gives non-player characters (NPCs) the ability to make their own choices based on the world around them. They decide where to eat or who to talk to and what they say. They sleep, go to church, and even steal items, all based on their individual characteristics. Full facial animations and lip-synching, combined with full speech for all dialog, allows NPCs to come to life like never before. [Bethesda]",94,8.7
Sid Meier's Civilization II,MicroProse,MicroProse, PC,1996-02-29,"An empire-building turn-based strategy game. The game starts at the Old Stone Age in 4000 BC. Your tribe begins with a Settlers unit and has no knowledge about the surrounding area. As you found new cities and explore the surroundings, you may find hostile barbarians, villages, and other competing cultures. [Civ Fantatics' Center]",94,8.8
Quake,id Software,GT Interactive, PC,1996-06-22,"Rage through 32 single player levels and 6 deathmatch levels of sheer terror and fully immersive sound and lighting. Arm yourself against the cannibalistic Ogre, fiendish Vore and indestructible Schambler using letal nails, fierce Thunderbolts and abominable Rocket and Grenade Launchers. [id Software]",94,8.8
Call of Duty 4: Modern Warfare,Infinity Ward,Activision, Xbox 360,2007-11-05,"As Call of Duty 4: Modern Warfare's single player campaign unfolds, the player is introduced to new gameplay at every turn – one moment you are fast-roping from your Black Hawk helicopter after storming into the war zone with an armada of choppers, the next you are a sniper, under concealment, in a Ghillie suit miles behind enemy lines, the next you are engaging hostiles from an AC-130 gunship thousands of feet above the battlefield. Mixed with explosive action, Call of Duty 4: Modern Warfare also delivers special effects, including use of depth of field, rim-lighting, character self-shadowing, real time post-processing, texture streaming as well as physics-enabled effects. Infinity Ward deployed a dedicated team from the start to deliver a new level of depth to multiplayer. Building on the hit ""Call of Duty 2"" online experience, Call of Duty 4: Modern Warfare's new multiplayer provides the community an addictive and accessible experience to gamers of all levels. [Activision]",94,8.5
BioShock Infinite,Irrational Games,2K, PC,2013-03-25,"Initially conceived as a floating symbol of American ideals at a time when the United States was emerging as a world power, Columbia is sent to distant shores with great fanfare by a captivated public. What begins as a fresh new endeavor of hope turns drastically wrong as the city soon disappears into the clouds to whereabouts unknown. The player takes on the role of former Pinkerton agent Booker DeWitt, sent to the lost city to rescue Elizabeth, a young lady imprisoned there since her childhood. He develops a relationship with Elizabeth, enhancing his abilities with hers so the pair may escape from a city that is literally falling from the sky. DeWitt has to learn to fight foes in high-speed Sky-Line battles, engage in combat both indoors and amongst the clouds, and harness the power of a myriad of new weapons and abilities.",94,8.6
Halo 3,Bungie,Microsoft, Xbox 360,2007-09-25,"Halo 3 is the third game in the Halo Trilogy and provides the thrilling conclusion to the events begun in ""Halo: Combat Evolved."" Halo 3 picks up where ""Halo 2"" left off. The Master Chief is returning to Earth to finish the fight. The Covenant occupation of Earth has uncovered a massive and ancient object beneath the African sands - an object who's secrets have yet to be revealed. Earth's forces are battered and beaten. The Master Chief's AI companion Cortana is still trapped in the clutches of the Gravemind - a horrifying Flood intelligence, and a civil war is raging in the heart of the Covenant. This is how the world ends... [Bungie]",94,8.1
Ninja Gaiden Black,Team Ninja,Tecmo, Xbox,2005-09-20,"In Ninja Gaiden Black you can reprise the role of Ryu Hayabusa, ninja extraordinaire. This sequel to Ninja Gaiden supplies a new story and new missions, plus two more difficulty settings and cinematic cut scenes that provide background about the protagonist. Ninja Gaiden Black also incorporates the additional content from Hurricane Packs 1 and 2 and includes unlockable content such as the original arcade version of Ninja Gaiden. Ninja Gaiden Black includes online features for keeping track of karma points on the online leader board.",94,8.8
The Elder Scrolls IV: Oblivion,Bethesda Game Studios,Bethesda Softworks, PC,2006-03-20,"Oblivion is a single-player game that takes place in Tamriel's capital province, Cyrodiil. You are given the task of finding the hidden heir to a throne that sits empty, the previous emperor having been killed by an unknown assassin. With no true Emperor, the gates to Oblivion (the equivalent of hell in the world of Tamriel) open, and demons begin to invade Cyrodiil and attack its people and towns. It's up to you to find the lost heir to the throne and unravel the sinister plot that threatens to destroy all of Tamriel. In keeping with the Elder Scrolls tradition, players have the option to experience the main quest at their own pace, and there are plenty of opportunities to explore the vast world and make your own way. Numerous factions can be joined, such as the thieves or mages guilds, and each contains its own complete storyline and the chance to rise to the head of the faction and reap further rewards. Oblivion features a groundbreaking new AI system, called Radiant AI, which gives non-player characters (NPCs) the ability to make their own choices based on the world around them. They decide where to eat or who to talk to and what they say. They sleep, go to church, and even steal items, all based on their individual characteristics. Full facial animations and lip-synching, combined with full speech for all dialog, allows NPCs to come to life like never before. [Bethesda]",94,8.2
Street Fighter IV,CAPCOM,CAPCOM, PlayStation 3,2009-02-17,"Street Fighter IV features a mix of returning favourites such as Ryu, Ken, Chun-Li and Guile along with new characters created exclusively for this game such as Crimson Viper, Abel, El Fuerte, and Rufus. Characters and environments are rendered in high definition 3D, while the game is played in the classic Street Fighter 2D perspective with additional 3D camera flourishes. Six-button controls for the game return, with a host of new special moves and features integrated into the input system. Street Fighter IV also incorporates state of the art online match making and worldwide online gameplay. Mixing classic genre-defining game mechanics the franchise is known and loved for with all-new, never-before-seen gameplay systems, Street Fighter IV brings a brand new fighting game to fans the world over. With the inclusion of Capcom's latest advancements in new generation technology, Street Fighter IV promises to deliver an extraordinary experience that will re-introduce the world to the time-honoured art of virtual martial arts. New special moves that go beyond any Street Fighter fan's wildest imagination, including Focus attacks, Super Combos, and the revenged-fueled Ultra Combo system. Classic Street Fighter characters recreated for a new generation of gamers, including the original cast of Street Fighter II. New brawlers: female super-spy Crimson Viper, lucha libre wrestler El Fuerte, mixed martial artist Abel and more. New gameplay elements provide new challenges for both newcomers and the most seasoned Street Fighter pro. Online gameplay features, including instantaneous online challenges, versus mode, tournament mode, and world wide online gameplay. [Capcom]",94,7.4
Super Mario Advance 4: Super Mario Bros. 3,Nintendo,Nintendo, Game Boy Advance,2003-10-21,"A combination of exciting platforming action, wild power-ups, and charming Mario style has made Super Mario Bros. 3 a classic. With Super Mario Advance 4: Super Mario Bros. 3, you have your chance to partake in the special adventure anywhere you go on your Game Boy Advance. Your mission is to rescue the Mushroom Kingdom monarchs who have been transformed into animals by Bowser and his mischievous offspring, and in the process save the princess kidnapped by Bowser. Traverse eight huge worlds and encounter fun minigames and frantic boss battles as you explore the first Mario game to use an overworld map.",94,8.9
Jet Grind Radio,Smilebit,Sega, Dreamcast,2000-10-30,"Join a graffiti crew, stamp your territory and protect it from rival taggers, but watch out for the angry cops!",94,8.3
Metal Gear Solid,Konami,Konami, PlayStation,1998-10-21,"You are Snake, a government agent on a mission to regain control of a secret nuclear weapons base from terrorist hands. Lightly armed and facing an army of foes, Snake must avoid firefights in order to survive. If Snake can locate them he can utilize advanced hardware, ranging from silenced pistols to ground-to-air missiles. Enemies react to sight and sound - so stay quiet and stay in the shadows. State-of-the-art graphics: textures, transparencies, models and explosions. Taut, gripping story with multiple endings - a truly cinematic experience.",94,9.2
Grim Fandango,LucasArts,LucasArts, PC,1998-10-14,"Something's rotten in the Land of Dead and you're being played for a sucker. Meet Manny Calavera, travel agent at the Department of Death. He sells luxury packages to souls on their four-year journey to eternal rest. But there's trouble in paradise. Help Manny untangle himself from a conspiracy that threatens his very salvation. [LucasArts]",94,9.1
Tom Clancy's Splinter Cell Chaos Theory,Ubisoft Montreal,Ubisoft, Xbox,2005-03-28,"As Sam Fisher, Third Echelon's most skilled Splinter Cell operative, you are assigned to execute a hazardous series of operations to investigate and eliminate a new source of information attacks originating in North Korea. At your disposal is a lethal array of tactics ranging from Combat Knife techniques to experimental prototype weapons skills and more-radical hand-to-hand techniques such as the Inverted Chokehold. Experience the intensity of acting as a lone operative fighting tomorrow's threats in the field and of cooperating online with a partner to accomplish crucial missions.",94,9.1
Resident Evil Code: Veronica,CAPCOM,CAPCOM, Dreamcast,2000-02-29,"Resident Evil Code: Veronica takes up the story of Claire Redfield, a character from Resident Evil 2. In that game she was searching for her brother Chris (a missing S.T.A.R.S. member) and in Resident Evil Code: Veronica we follow her to Europe where she continues her search at Umbrella headquarters.",94,8.5
Burnout 3: Takedown,Criterion Games,EA Games, Xbox,2004-09-07,"Burnout 3 challenges you to crash into (and through) busy intersections, while creating as much damage as possible. You can battle your way to the front of the pack by taking down rivals and causing spectacular crashes. For those who thirst for crashes, the game includes a crash mode that rewards you for creating massive pileups. With multiplayer gameplay, more than 100 events, and 40 tracks, Burnout 3 provides intense speed and action.",94,7.7
