name,developer,publisher,platform,release_date,summary,meta_score,user_review
The Legend of Zelda: Ocarina of Time,Nintendo,Nintendo, Nintendo 64,1998-11-23,"As a young boy, Link is tricked by Ganondorf, the King of the Gerudo Thieves. The evil human uses Link to gain access to the Sacred Realm, where he places his tainted hands on Triforce and transforms the beautiful Hyrulean landscape into a barren wasteland. Link is determined to fix the problems he helped to create, so with the help of Rauru he travels through time gathering the powers of the Seven Sages.",99,9.1
Tony Hawk's Pro Skater 2,Neversoft,Activision, PlayStation,2000-09-20,"As most major publishers' development efforts shift to any number of next-generation platforms, Tony Hawk 2 will likely stand as one of the last truly fantastic games to be released on the PlayStation.",98,7.4
Grand Theft Auto IV,Rockstar North,Rockstar Games, PlayStation 3,2008-04-29,"[Metacritic's 2008 PS3 Game of the Year; Also known as ""GTA IV""] What does the American Dream mean today? For Niko Belic, fresh off the boat from Europe. It's the hope he can escape his past. For his cousin, Roman, it is the vision that together they can find fortune in Liberty City, gateway to the land of opportunity. As they slip into debt and are dragged into a criminal underworld by a series of shysters, thieves and sociopaths, they discover that the reality is very different from the dream in a city that worships money and status, and is heaven for those who have them an a living nightmare for those who don't. [Rockstar Games]",98,7.7
SoulCalibur,Project Soul,Namco, Dreamcast,1999-09-08,"This is a tale of souls and swords, transcending the world and all its history, told for all eternity... The greatest weapons-based fighter returns, this time on Sega Dreamcast. Soul Calibur unleashes incredible graphics, fantastic fighters, and combos so amazing they'll make your head spin!",98,8.4
Grand Theft Auto IV,Rockstar Games,Rockstar Games, Xbox 360,2008-04-29,"[Metacritic's 2008 Xbox 360 Game of the Year; Also known as ""GTA IV""] What does the American Dream mean today? For Niko Belic, fresh off the boat from Europe. It's the hope he can escape his past. For his cousin, Roman, it is the vision that together they can find fortune in Liberty City, gateway to the land of opportunity. As they slip into debt and are dragged into a criminal underworld by a series of shysters, thieves and sociopaths, they discover that the reality is very different from the dream in a city that worships money and status, and is heaven for those who have them an a living nightmare for those who don't. [Rockstar Games]",98,7.9
Super Mario Galaxy,Nintendo,Nintendo, Wii,2007-11-12,"[Metacritic's 2007 Wii Game of the Year] The ultimate Nintendo hero is taking the ultimate step ... out into space. Join Mario as he ushers in a new era of video games, defying gravity across all the planets in the galaxy. When some creature escapes into space with Princess Peach, Mario gives chase, exploring bizarre planets all across the galaxy. Mario, Peach and enemies new and old are here. Players run, jump and battle enemies as they explore all the planets in the galaxy. Since this game makes full use of all the features of the Wii Remote, players have to do all kinds of things to succeed: pressing buttons, swinging the Wii Remote and the Nunchuk, and even pointing at and dragging things with the pointer. Since he's in space, Mario can perform mind-bending jumps unlike anything he's done before. He'll also have a wealth of new moves that are all based around tilting, pointing and shaking the Wii Remote. Shake, tilt and point! Mario takes advantage of all the unique aspects of the Wii Remote and Nunchuk controller, unleashing new moves as players shake the controller and even point at and drag items with the pointer. [Nintendo]",97,9.1
Super Mario Galaxy 2,Nintendo,Nintendo, Wii,2010-05-23,"Super Mario Galaxy 2, the sequel to the galaxy-hopping original game, includes the gravity-defying, physics-based exploration from the first game, but is loaded with entirely new galaxies and features to challenge players. On some stages, Mario can pair up with his dinosaur buddy Yoshi and use his tongue to grab items and spit them back at enemies. Players can also have fun with new items such as a drill that lets our hero tunnel through solid rock. [Nintendo]",97,9.1
Red Dead Redemption 2,Rockstar Games,Rockstar Games, Xbox One,2018-10-26,"Developed by the creators of Grand Theft Auto V and Red Dead Redemption, Red Dead Redemption 2 is an epic tale of life in America’s unforgiving heartland. The game’s vast and atmospheric world also provides the foundation for a brand new online multiplayer experience. America, 1899. The end of the Wild West era has begun. After a robbery goes badly wrong in the western town of Blackwater, Arthur Morgan and the Van der Linde gang are forced to flee. With federal agents and the best bounty hunters in the nation massing on their heels, the gang has to rob, steal and fight their way across the rugged heartland of America in order to survive. As deepening internal fissures threaten to tear the gang apart, Arthur must make a choice between his own ideals and loyalty to the gang that raised him. [Rockstar]",97,8
Grand Theft Auto V,Rockstar Games,Rockstar Games, Xbox One,2014-11-18,"Grand Theft Auto 5 melds storytelling and gameplay in unique ways as players repeatedly jump in and out of the lives of the game's three protagonists, playing all sides of the game's interwoven story.",97,7.9
Grand Theft Auto V,Rockstar Games,Rockstar Games, PlayStation 3,2013-09-17,"Los Santos is a vast, sun-soaked metropolis full of self-help gurus, starlets and once-important, formerly-known-as celebrities. The city was once the envy of the Western world, but is now struggling to stay afloat in an era of economic uncertainty and reality TV. Amidst the chaos, three unique criminals plot their own chances of survival and success: Franklin, a former street gangster in search of real opportunities and serious cheddar; Michael, a professional ex-con whose retirement is a lot less rosy than he hoped it would be; and Trevor, a violent maniac driven by the chance of a cheap high and the next big score. Quickly running out of options, the crew risks it all in a sequence of daring and dangerous heists that could set them up for life.",97,8.3
Disco Elysium: The Final Cut,ZA/UM,ZA/UM, PC,2021-03-30,"Disco Elysium - The Final Cut is the definitive edition of the smash-hit RPG. Pursue your political dreams in new quests, meet and question more of the city's locals, and explore a whole extra area. Full voice-acting, controller support, and expanded language options also included. Get even more out of this award-winning open world. You're a detective with a unique skill system at your disposal and a whole city block to carve your path across. Interrogate unforgettable characters, crack murders, or take bribes. Become a hero or an absolute disaster of a human being.",97,8.3
Grand Theft Auto V,Rockstar Games,Rockstar Games, Xbox 360,2013-09-17,"Los Santos is a sprawling sun-soaked metropolis full of self-help gurus, starlets and once-important stars. The city was once the envy of the Western world, but is now struggling to stay relevant in an era of economic uncertainty and reality TV. Amidst the chaos, three very different criminals chart their own chances of survival and success: Franklin, a former street gangster, now looking for real opportunities and fat stacks of cash; Michael, a professional ex-con whose retirement is significantly less rosy than he hoped it would be; and Trevor, a violent maniac driven by the chance of a cheap high and the next big score. Rapidly running out of options, the crew risks everything in a series of bolt and dangerous heists that could set them up for the long haul.",97,8.3
Tony Hawk's Pro Skater 2,Neversoft,Activision, Dreamcast,2000-11-06,"Hawk's back - with new technology, new pros and new tricks! THPS2, the legend rides on! Skate as legendary Tony Hawk or any one of 12 other pro skaters. Create your own custom skaters. Multiple play modes including 1-Player, Career and Free Skate modes, as well as 2-player modes such as Trick Attack, Graffiti Tag and Horse. Build your own custom skate parks with the real-time 3D park editor.",97,6.2
The Legend of Zelda: Breath of the Wild,Nintendo,Nintendo, Switch,2017-03-03,"Forget everything you know about The Legend of Zelda games. Step into a world of discovery, exploration and adventure in The Legend of Zelda: Breath of the Wild, a boundary-breaking new game in the acclaimed series. Travel across fields, through forests and to mountain peaks as you discover what has become of the ruined kingdom of Hyrule in this open-air adventure. Explore the wilds of Hyrule any way you like - Climb up towers and mountain peaks in search of new destinations, then set your own path to get there and plunge into the wilderness. Along the way, you'll battle towering enemies, hunt wild beasts and gather ingredients for the food and elixirs you'll need to sustain you on your journey. More than 100 Shrines of Trials to discover and explore - Shrines dot the landscape, waiting to be discovered in any order you want. Search for them in various ways, and solve a variety of puzzles inside. Work your way through the traps and devices inside to earn special items and other rewards that will help you on your adventure. * Be prepared and properly equipped - With an entire world waiting to be explored, you'll need a variety of outfits and gear to reach every corner. You may need to bundle up with warmer clothes or change into something better suited to the desert heat. Some clothing even has special effects that, for example, can make you faster and stealthier. * Battling enemies requires strategy - The world is inhabited with enemies of all shapes and sizes. Each one has its own attack method and weaponry, so you must think quickly and develop the right strategies to defeat them. * amiibo compatibility - Tap the Wolf Link amiibo (sold separately) to make Wolf Link appear in game. Wolf Link will attack enemies on his own and help you find items you're searching for.",97,8.7
Tony Hawk's Pro Skater 3,Neversoft,Activision, PlayStation 2,2001-10-28,Challenge up to four friends in online competitions over a LAN or the Internet. Take them on in both Trick Attack and Graffiti modes. [Activision],97,7.5
Perfect Dark,Rare,Rare, Nintendo 64,2000-05-22,"Step into the Dark... As Carrington Institute's most promising new Agent, Joanna Dark must uncover the truth behind the dataDyne Corporation's recent technological breakthroughs - breakthroughs which could have serious consequences for mankind.",97,8.8
Red Dead Redemption 2,Rockstar Games,Rockstar Games, PlayStation 4,2018-10-26,"Developed by the creators of Grand Theft Auto V and Red Dead Redemption, Red Dead Redemption 2 is an epic tale of life in America’s unforgiving heartland. The game’s vast and atmospheric world also provides the foundation for a brand new online multiplayer experience. America, 1899. The end of the Wild West era has begun. After a robbery goes badly wrong in the western town of Blackwater, Arthur Morgan and the Van der Linde gang are forced to flee. With federal agents and the best bounty hunters in the nation massing on their heels, the gang has to rob, steal and fight their way across the rugged heartland of America in order to survive. As deepening internal fissures threaten to tear the gang apart, Arthur must make a choice between his own ideals and loyalty to the gang that raised him. [Rockstar]",97,8.5
Grand Theft Auto V,Rockstar Games,Rockstar Games, PlayStation 4,2014-11-18,"The sprawling sun-soaked metropolis of Los Santos is chock full of self-help coaches, starlets and C-List celebrities, once on top of the media world, now struggling to stay relevant in time of economic malaise and lowest-common-denominator reality TV. Amidst this madness, three unique criminals plan their own chances of survival and success: Franklin, a street-level hustler in search of opportunities for serious money; Michael, an ex-con whose ""retirement"" is a less rosy than he hoped it would be; and Trevor, a violent dude driven by the chance for a quick high and the next big score. Nearly out of options, the crew risks it all in a series of daring and dangerous heists that could set them up for life - one way or the other.",97,8.4
Metroid Prime,Retro Studios,Nintendo, GameCube,2002-11-17,"Samus returns in a new mission to unravel the mystery behind the ruined walls scattered across Tallon IV. In Metroid Prime, you'll play the role of this bounty hunter and view the world through her visor, which displays information ranging from current energy levels to ammunition. Equipped with a Power Beam and Gravity Suit, you must shoot locked switches, solve puzzles, and eliminate enemies. It's up to you to explore the world and recover more power-ups and weapons, which gradually open more gameplay areas.",97,8.6
Grand Theft Auto III,DMA Design,Rockstar Games, PlayStation 2,2001-10-22,"Players are put at the heart of their very own gangster movie, and let loose in a fully-realised 3 dimensional city with a cast of hundreds, 50 plus vehicles, ranging from sports cars to ice cream trucks and from boats to buses, 3 hours of music, including opera, reggae, house, drum and bass, pop and disco, and a huge array of street ready weapons. [Rockstar Games]",97,8.4
Super Mario Odyssey,Nintendo,Nintendo, Switch,2017-10-27,"New Evolution of Mario Sandbox-Style Gameplay. Mario embarks on a new journey through unknown worlds, running and jumping through huge 3D worlds in the first sandbox-style Mario game since Super Mario 64 and Super Mario Sunshine. Set sail between expansive worlds aboard an airship, and perform all-new actions, such as throwing Mario's cap.",97,8.9
Halo: Combat Evolved,Bungie,Microsoft, Xbox,2001-11-14,"Enter the mysterious world of Halo, an alien planet shaped like a ring. As mankind's super soldier Master Chief, you must uncover the secrets of Halo and fend off the attacking Covenant. During your missions, you'll battle on foot, in vehicles, inside, and outside with alien and human weaponry. Your objectives include attacking enemy outposts, raiding underground labs for advanced technology, rescuing fallen comrades, and sniping enemy forces. Halo also lets you battle three other players via intense split screen combat or fight cooperatively with a friend through the single-player missions.",97,8.7
The House in Fata Morgana - Dreams of the Revenants Edition -,Novectacle,Novectacle, Switch,2021-04-09,"A gothic suspense tale set in a cursed mansion. ‘The House in Fata Morgana’ is a full-length visual novel spanning nearly a millennium that deals in tragedy, human nature, and insanity. This version includes three games and more: 1: The House in Fata Morgana: the main storyline. 2: A Requiem for Innocence: a prequel shedding light on the origins of Fata Morgana’s terrible curse. 3: Reincarnation: a sequel featuring the central cast members reincarnated in the present day. *The part including voices 4: Other additional short stories.",97,8.2
NFL 2K1,Visual Concepts,Sega, Dreamcast,2000-09-07,"In the end, NFL 2K1 is a deeper, more refined version of the original game.",97,6.2
Half-Life 2,Valve,Valve, PC,2004-11-16,"[Metacritic's 2004 PC Game of the Year] By taking the suspense, challenge and visceral charge of the original, and adding startling new realism and responsiveness, Half-Life 2 opens the door to a world where the player's presence affects everything around him, from the physical environment to the behaviors -- even the emotions -- of both friends and enemies. The player again picks up the crowbar of research scientist Gordon Freeman, who finds himself on an alien-infested Earth being picked to the bone, its resources depleted, its populace dwindling. Freeman is thrust into the unenviable role of rescuing the world from the wrong he unleashed back at Black Mesa. And a lot of people -- people he cares about -- are counting on him. [Vivendi Universal]",96,9.2
Grand Theft Auto V,Rockstar Games,Rockstar Games, PC,2015-04-13,"Los Santos: a sprawling sun-soaked metropolis full of self-help gurus, starlets and fading celebrities, once the envy of the Western world, now struggling to stay alive in a time of economic uncertainty and cheap reality TV. Amidst the turmoil, three very unique criminals plot their own chances of survival and success: Franklin, a street hustler looking for tangible opportunities and serious money; Michael, a professional ex-con whose retirement is less rosy than he figured it would be; and Trevor, a violent dude driven by the opportunity for a cheap high and his next big score. With options at a premium, the crew risks it all in a myriad of daring and dangerous heists that could set them up for life.",96,7.8
The Legend of Zelda: Breath of the Wild,Nintendo,Nintendo, Wii U,2017-03-03,"Ignore everything you know about The Legend of Zelda games. Step into a world of discovery, exploration and adventure in The Legend of Zelda: Breath of the Wild. Travel across fields, through forests and to mountain peaks as you discover what has become of the ruined kingdom of Hyrule in this stunning open-air adventure. Explore the wilds of Hyrule any way you like - Climb up towers and mountain peaks in search of new destinations, then set your own path to get there and plunge into the wilderness. Along the way, you'll battle towering enemies, hunt wild beasts and gather ingredients for the food and elixirs you'll need to sustain you on your journey. More than 100 Shrines of Trials to discover and explore - Shrines dot the landscape, waiting to be discovered in any order you want. Search for them in various ways, and solve a variety of puzzles inside. Work your way through the traps and devices inside to earn special items and other rewards that will help you on your adventure. Be prepared and properly equipped - With an entire world waiting to be explored, you'll need a variety of outfits and gear to reach every corner. You may need to bundle up with warmer clothes or change into something better suited to the desert heat. Some clothing even has special effects that, for example, can make you faster and stealthier. [Nintendo]",96,8.3
BioShock,2K Boston,2K, Xbox 360,2007-08-21,"[Metacritic's 2007 Xbox 360 Game of the Year] Going beyond ""run and gun corridors,"" ""monster-closet AIs"" and static worlds, BioShock creates a living, unique and unpredictable FPS experience. After your plane crashes into icy uncharted waters, you discover a rusted bathysphere and descend into Rapture, a city hidden beneath the sea. Constructed as an idealistic society for a hand picked group of scientists, artists and industrialists, the idealism is no more. Now the city is littered with corpses, wildly powerful guardians roam the corridors as little girls loot the dead, and genetically mutated citizens ambush you at every turn. Take control of your world by hacking mechanical devices, commandeering security turrets and crafting unique items critical to your very survival. Upgrade your weapons with ionic gels, explosives and toxins to customize them to the enemy and environment. Genetically modify your body through dozens of Plasmid Stations scattered throughout the city, empowering you with fantastic and often grotesque abilities. Explore a living world powered by Ecological A.I., where the inhabitants have interesting and consequential relationships with one another that impact your gameplay experience. Experience truly next generation graphics that vividly illustrate the forlorn art deco city, highlighted by the most detailed and realistic water effects ever developed in a video game. Make meaningful choices and mature decisions, ultimately culminating in the grand question: do you exploit the innocent survivors of Rapture...or save them? [2K Games]",96,9
GoldenEye 007,Rare,Nintendo, Nintendo 64,1997-08-25,You are Bond. James Bond. You are assigned covert operations connected with the GoldenEye weapons satellite. M will brief you on your mission and objectives from London. Q Branch will support your efforts with a plentiful supply of weapons and gadgets. Moneypenny offers you light-hearted best wishes and you're off! Your mission begins in the heavily guarded chemical warfare facility at the Byelomorye Dam in the USSR. Look and shoot in any direction as you navigate 12 interactive 3-D environments. Use stealth and force as you see fit in matters of international security. Consider the military personnel expendable. You are licensed to kill!,96,9
Uncharted 2: Among Thieves,Naughty Dog,Sony Computer Entertainment, PlayStation 3,2009-10-13,"Fortune hunter Nathan Drake returns in Uncharted 2: Among Thieves, a third-person action-adventure/shooter created by award-winning developer Naughty Dog. Down on his luck, Drake is lured back into the treacherous world of thieves and mercenary treasure-seekers he had sought to leave behind. When a mysterious artifact propels Drake on an expedition to find the legendary Himalayan valley of Shambhala, he finds himself embroiled in a dangerous game of cat-and-mouse against a fugitive war criminal who’s after more than just the fabled riches of the lost city. Caught in a web of deception and plunged into an increasingly deadly pursuit that tests the limits of his endurance, Drake will be forced to risk everything - but has his luck finally run out? [SCEA]",96,8.8
Resident Evil 4,CAPCOM,CAPCOM, GameCube,2005-01-11,"Resident Evil 4 marks a new chapter in the Resident Evil series. You'll rejoin Leon S. Kennedy six years after his first mission as a rookie cop from Resident Evil 2. Now a US agent, Leon is on a top secret mission to investigate the disappearance of the president's daughter. As Leon, you must make your way to a mysterious location in Europe, where new enemies await. Take them down by using enhanced aim-and-shoot features and a new action button.",96,9.2
The Orange Box,Valve,Valve, Xbox 360,2007-10-10,"Games included in The Orange Box compilation: The original Half-Life 2 - The player again picks up the crowbar of research scientist Gordon Freeman, who finds himself on an alien-infested Earth being picked to the bone, its resources depleted, its populace dwindling. Freeman is thrust into the unenviable role of rescuing the world from the wrong he unleashed back at Black Mesa. And a lot of people - people he cares about - are counting on him. Half-Life 2: Episode One - The player reprises his role of Dr. Freeman, who must immediately face the repercussions of his actions in City 17 and the Citadel. Freeman reconnects with Alyx Vance and her robot, Dog, as they continue their support of the resistance's battle against the Combine forces. Half-Life 2: Episode Two -- the second installment in Valve's episodic trilogy advances the award-winning story, leading the player to new locations outside of City 17. Portal - a pioneering type of single player action game that rewrites the rules for how players approach and manipulate their environment – much like how Half-Life 2's Gravity Gun reinvented the way gamers interact with objects in the game. Team Fortress 2 - an all-new version of the legendary title that spawned team based multiplayer action games. The game's daring new art style features the most advanced graphics of any Source-based game released to date. [Valve Software]",96,9
The Orange Box,Valve,Valve, PC,2007-10-10,"Games included in The Orange Box compilation: The original Half-Life 2 - The player again picks up the crowbar of research scientist Gordon Freeman, who finds himself on an alien-infested Earth being picked to the bone, its resources depleted, its populace dwindling. Freeman is thrust into the unenviable role of rescuing the world from the wrong he unleashed back at Black Mesa. And a lot of people - people he cares about - are counting on him. Half-Life 2: Episode One - The player reprises his role of Dr. Freeman, who must immediately face the repercussions of his actions in City 17 and the Citadel. Freeman reconnects with Alyx Vance and her robot, Dog, as they continue their support of the resistance's battle against the Combine forces. Half-Life 2: Episode Two -- the second installment in Valve's episodic trilogy advances the award-winning story, leading the player to new locations outside of City 17. Portal - a pioneering type of single player action game that rewrites the rules for how players approach and manipulate their environment – much like how Half-Life 2's Gravity Gun reinvented the way gamers interact with objects in the game. Team Fortress 2 - an all-new version of the legendary title that spawned team based multiplayer action games. The game's daring new art style features the most advanced graphics of any Source-based game released to date. [Valve Software]",96,9.3
Batman: Arkham City,Rocksteady Studios,Warner Bros., PlayStation 3,2011-10-18,"Developed by Rocksteady Studios, Batman: Arkham City builds upon the intense, atmospheric foundation of Batman: Arkham Asylum, sending players soaring into Arkham City, the new maximum security ""home"" for all of Gotham City's thugs, gangsters and insane criminal masterminds. Set inside the heavily fortified walls of a sprawling district in the heart of Gotham City, this highly anticipated sequel introduces a brand-new story that draws together a new all-star cast of classic characters and murderous villains from the Batman universe, as well as a vast range of new and enhanced gameplay features to deliver the ultimate experience as the Dark Knight.",96,8.8
